Title,Authors,Publication date,Journal,Volume,Issue,Publisher,Description,Total citations,Scholar articles,Citation Count,Pages,Conference,Book
Collective learning from diverse datasets for entity typing in the wild,"Abhishek Abhishek, Amar Prakash Azad, Balaji Ganesan, Ashish Anand, Amit Awekar",2018/10/20,arXiv preprint arXiv:1810.08782,,,,"Entity typing (ET) is the problem of assigning labels to given entity mentions in a sentence. Existing works for ET require knowledge about the domain and target label set for a given test instance. ET in the absence of such knowledge is a novel problem that we address as ET in the wild. We hypothesize that the solution to this problem is to build supervised models that generalize better on the ET task as a whole, rather than a specific dataset. In this direction, we propose a Collective Learning Framework (CLF), which enables learning from diverse datasets in a unified way. The CLF first creates a unified hierarchical label set (UHLS) and a label mapping by aggregating label information from all available datasets. Then it builds a single neural network classifier using UHLS, label mapping, and a partial loss function. The single classifier predicts the finest possible label across all available domains even though these labels may not be present in any domain-specific dataset. We also propose a set of evaluation schemes and metrics to evaluate the performance of models in this novel problem. Extensive experimentation on seven diverse real-world datasets demonstrates the efficacy of our CLF.",2,"Collective learning from diverse datasets for entity typing in the wild
A Abhishek, AP Azad, B Ganesan, A Anand, A Awekar - arXiv preprint arXiv:1810.08782, 2018
Cited by 2 Related articles All 2 versions",{'2020': 2},,,
Drug-drug interaction extraction from biomedical texts using long short-term memory network,"Sunil Kumar Sahu, Ashish Anand",2018/10/1,Journal of biomedical informatics,86,,Academic Press,"The simultaneous administration of multiple drugs increases the probability of interaction among them, as one drug may affect the activities of others. This interaction among drugs may have a positive or negative impact on the therapeutic outcomes. Thus, identification of unknown drug-drug interactions (DDIs) is of significant concern for improving the safety and efficacy of drug consumption. Although multiple DDI resources exist, it is becoming infeasible to maintain these up-to-date manually with the number of biomedical texts growing at a fast pace. Most existing methods model DDI extraction as a classification problem and rely mainly on handcrafted features, and certain features further depend on domain-specific tools. Recently, neural network models using latent features have been demonstrated to yield similar or superior performance compared to existing models. In this study, we present three long short-term …",177,"Drug-drug interaction extraction from biomedical texts using long short-term memory network
SK Sahu, A Anand - Journal of biomedical informatics, 2018
Cited by 177 Related articles All 7 versions","{'2017': 6, '2018': 13, '2019': 34, '2020': 40, '2021': 39, '2022': 34, '2023': 10}",15-24,,
SpliceVec: distributed feature representations for splice junction prediction,"Aparajita Dutta, Tushar Dubey, Kusum Kumari Singh, Ashish Anand",2018/6/1,Computational biology and chemistry,74,,Elsevier,"Identification of intron boundaries, called splice junctions, is an important part of delineating gene structure and functions. This also provides valuable insights into the role of alternative splicing in increasing functional diversity of genes. Identification of splice junctions through RNA-seq is by mapping short reads to the reference genome which is prone to errors due to random sequence matches. This encourages identification of splicing junctions through computational methods based on machine learning. Existing models are dependent on feature extraction and selection for capturing splicing signals lying in the vicinity of splice junctions. But such manually extracted features are not exhaustive. We introduce distributed feature representation, SpliceVec, to avoid explicit and biased feature extraction generally adopted for such tasks. SpliceVec is based on two widely used distributed representation models in natural …",23,"SpliceVec: distributed feature representations for splice junction prediction
A Dutta, T Dubey, KK Singh, A Anand - Computational biology and chemistry, 2018
Cited by 23 Related articles All 10 versions","{'2018': 5, '2019': 4, '2020': 3, '2021': 6, '2022': 4, '2023': 1}",434-441,,
What matters in a transferable neural network model for relation classification in the biomedical domain?,"Sunil Kumar Sahu, Ashish Anand",2018/5/1,Artificial Intelligence in Medicine,87,,Elsevier,"A lack of sufficient labeled data often limits the applicability of advanced machine learning algorithms to real life problems. However, the efficient use of transfer learning (TL) has been shown to be very useful across domains. TL make use of valuable knowledge learned in one task (source task), where sufficient data is available, in order to improve performance on the task of interest (target task). In the biomedical and clinical domain, a lack of sufficient training data means that machine learning models cannot be fully exploited. In this work, we present two unified recurrent neural models leading to three transfer learning frameworks for relation classification tasks. We systematically investigate the effectiveness of the proposed frameworks in transferring knowledge from a source task to a target task when the characteristics of the source data vary, such as similarity or relatedness between the source and target tasks …",10,"What matters in a transferable neural network model for relation classification in the biomedical domain?
SK Sahu, A Anand - Artificial Intelligence in Medicine, 2018
Cited by 10 Related articles All 7 versions","{'2018': 4, '2019': 1, '2020': 1, '2021': 2, '2022': 2}",60-66,,
A unified labeling approach by pooling diverse datasets for entity typing,"Amar Prakash Azad, Balaji Ganesan, Ashish Anand, Amit Awekar",2018,arXiv preprint arXiv:1810.08782,,,,,1,"A unified labeling approach by pooling diverse datasets for entity typing
AP Azad, B Ganesan, A Anand, A Awekar - arXiv preprint arXiv:1810.08782, 2018
Cited by 1 Related articles",{'2019': 1},,,
Inference of splicing motifs through visualization of recurrent networks,"Aparajita Dutta, Aman Dalmia, R Athul, Kusum Kumari Singh, Ashish Anand",2018,bioRxiv,,,,"Neural models have been able to obtain state-of-the-art performances on several genome sequence-based prediction tasks. Often such models take only nucleotide sequences as input and learn relevant features on its own. However, extracting the interpretable motifs from the model remains a challenge. This work explores four existing visualization techniques in their ability to infer relevant sequence patterns learned by a recurrent neural network (RNN) on the task of splice junction identification. The visualization techniques have been modulated to suit the genome sequences as input. The visualizations inspect genomic regions at the level of a single nucleotide as well as a span of consecutive nucleotides. This inspection is performed from the perspective of the overall model as well as individual sequences. We infer canonical and non-canonical splicing motifs from a single neural model. We also propose a cumulative scoring function that ranks the combination of significant regions across the sequences involved",1,"Inference of splicing motifs through visualization of recurrent networks
A Dutta, A Dalmia, R Athul, KK Singh, A Anand - bioRxiv, 2018
Cited by 1 Related articles All 2 versions",{'2019': 1},,,
Rapid Reconstruction of Time-varying Gene Regulatory Networks,"Saptarshi Pyne, Alok Ranjan Kumar, A Anand",2018,IEEE/ACM Transactions on Computational Biology and Bioinformatics,,,IEEE,"Rapid advancements in high-throughput technologies have resulted in genome-scale time series datasets. Uncovering the temporal sequence of gene regulatory events, in the form of time-varying gene regulatory networks (GRNs), demands computationally fast, accurate, and scalable algorithms. The existing algorithms can be divided into two categories: ones that are time-intensive and hence unscalable; and others that impose structural constraints to become scalable. In this paper, a novel algorithm, namely ‘an algorithm for reconstructing Time-varying Gene regulatory networks with Shortlisted candidate regulators’ ( TGS ), is proposed. TGS is time-efficient and does not impose any structural constraints. Moreover, it provides such flexibility and time-efficiency, without losing its accuracy. TGS consistently outperforms the state-of-the-art algorithms in true positive detection, on three benchmark synthetic …",4,"Rapid reconstruction of time-varying gene regulatory networks
S Pyne, AR Kumar, A Anand - IEEE/ACM Transactions on Computational Biology and …, 2018
Cited by 4 Related articles All 8 versions",{},,,
Investigating how well contextual features are captured by bi-directional recurrent neural network models,"Kushal Chawla, Sunil Kumar Sahu, Ashish Anand",2017/9/3,arXiv preprint arXiv:1709.00659,,,,"Learning algorithms for natural language processing (NLP) tasks traditionally rely on manually defined relevant contextual features. On the other hand, neural network models using an only distributional representation of words have been successfully applied for several NLP tasks. Such models learn features automatically and avoid explicit feature engineering. Across several domains, neural models become a natural choice specifically when limited characteristics of data are known. However, this flexibility comes at the cost of interpretability. In this paper, we define three different methods to investigate ability of bi-directional recurrent neural networks (RNNs) in capturing contextual features. In particular, we analyze RNNs for sequence tagging tasks. We perform a comprehensive analysis on general as well as biomedical domain datasets. Our experiments focus on important contextual words as features, which can easily be extended to analyze various other feature types. We also investigate positional effects of context words and show how the developed methods can be used for error analysis.",2,"Investigating how well contextual features are captured by bi-directional recurrent neural network models
K Chawla, SK Sahu, A Anand - arXiv preprint arXiv:1709.00659, 2017
Cited by 2 Related articles All 7 versions",{},,,
Learning local and global contexts using a convolutional recurrent network model for relation classification in biomedical text,"Desh Raj, Sunil Sahu, Ashish Anand",2017/8,,,,,"The task of relation classification in the biomedical domain is complex due to the presence of samples obtained from heterogeneous sources such as research articles, discharge summaries, or electronic health records. It is also a constraint for classifiers which employ manual feature engineering. In this paper, we propose a convolutional recurrent neural network (CRNN) architecture that combines RNNs and CNNs in sequence to solve this problem. The rationale behind our approach is that CNNs can effectively identify coarse-grained local features in a sentence, while RNNs are more suited for long-term dependencies. We compare our CRNN model with several baselines on two biomedical datasets, namely the i2b2-2010 clinical relation extraction challenge dataset, and the SemEval-2013 DDI extraction dataset. We also evaluate an attentive pooling technique and report its performance in comparison with the conventional max pooling method. Our results indicate that the proposed model achieves state-of-the-art performance on both datasets.",38,"Learning local and global contexts using a convolutional recurrent network model for relation classification in biomedical text
D Raj, S Sahu, A Anand - Proceedings of the 21st conference on computational …, 2017
Cited by 38 Related articles All 5 versions","{'2018': 9, '2019': 12, '2020': 5, '2021': 5, '2022': 5, '2023': 2}",311-321,Proceedings of the 21st conference on computational natural language learning (CoNLL 2017),
Representation learning of drug and disease terms for drug repositioning,"Sahil Manchanda, Ashish Anand",2017/6/21,,,,IEEE,"Drug repositioning (DR) refers to identification of novel indications for the approved drugs. The requirement of huge investment of time as well as money and risk of failure in clinical trials have led to surge in interest in drug repositioning. DR exploits two major aspects associated with drugs and diseases: existence of similarity among drugs and among diseases due to their shared involved genes or pathways or common biological effects. Existing methods of identifying drug-disease association majorly rely on the information available in the structured databases only. On the other hand, abundant information available in form of free texts in biomedical research articles are not being fully exploited. Word-embedding or obtaining vector representation of words from a large corpora of free texts using neural network methods have been shown to give significant performance for several natural language processing tasks …",6,"Representation learning of drug and disease terms for drug repositioning
S Manchanda, A Anand - 2017 3rd IEEE International Conference on …, 2017
Cited by 6 Related articles All 6 versions",{},1-6,2017 3rd IEEE International Conference on Cybernetics (CYBCONF),
Biomedical event trigger identification using bidirectional recurrent neural network based models,"Patchigolla VSS Rahul, Sunil Kumar Sahu, Ashish Anand",2017/5/26,arXiv preprint arXiv:1705.09516,,,,Biomedical events describe complex interactions between various biomedical entities. Event trigger is a word or a phrase which typically signifies the occurrence of an event. Event trigger identification is an important first step in all event extraction methods. However many of the current approaches either rely on complex hand-crafted features or consider features only within a window. In this paper we propose a method that takes the advantage of recurrent neural network (RNN) to extract higher level features present across the sentence. Thus hidden state representation of RNN along with word and entity type embedding as features avoid relying on the complex hand-crafted features generated using various NLP toolkits. Our experiments have shown to achieve state-of-art F1-score on Multi Level Event Extraction (MLEE) corpus. We have also performed category-wise analysis of the result and discussed the importance of various features in trigger identification task.,40,"Biomedical event trigger identification using bidirectional recurrent neural network based models
PVSS Rahul, SK Sahu, A Anand - arXiv preprint arXiv:1705.09516, 2017
Cited by 40 Related articles All 8 versions","{'2017': 1, '2018': 5, '2019': 11, '2020': 10, '2021': 10, '2022': 2, '2023': 1}",,,
Fine-grained entity type classification by jointly learning representations and label embeddings,"Ashish Anand, Amit Awekar",2017/2/22,arXiv preprint arXiv:1702.06709,,,,"Fine-grained entity type classification (FETC) is the task of classifying an entity mention to a broad set of types. Distant supervision paradigm is extensively used to generate training data for this task. However, generated training data assigns same set of labels to every mention of an entity without considering its local context. Existing FETC systems have two major drawbacks: assuming training data to be noise free and use of hand crafted features. Our work overcomes both drawbacks. We propose a neural network model that jointly learns entity mentions and their context representation to eliminate use of hand crafted features. Our model treats training data as noisy and uses non-parametric variant of hinge loss function. Experiments show that the proposed model outperforms previous state-of-the-art methods on two publicly available datasets, namely FIGER (GOLD) and BBN with an average relative improvement of 2.69% in micro-F1 score. Knowledge learnt by our model on one dataset can be transferred to other datasets while using same model or other FETC systems. These approaches of transferring knowledge further improve the performance of respective models.",92,"Fine-grained entity type classification by jointly learning representations and label embeddings
A Anand, A Awekar - arXiv preprint arXiv:1702.06709, 2017
Cited by 92 Related articles All 6 versions","{'2018': 13, '2019': 18, '2020': 24, '2021': 14, '2022': 22, '2023': 1}",,,
Recurrent neural network models for disease name recognition using domain invariant features,"Sunil Kumar Sahu, Ashish Anand",2016/6/30,arXiv preprint arXiv:1606.09371,,,,"Hand-crafted features based on linguistic and domain-knowledge play crucial role in determining the performance of disease name recognition systems. Such methods are further limited by the scope of these features or in other words, their ability to cover the contexts or word dependencies within a sentence. In this work, we focus on reducing such dependencies and propose a domain-invariant framework for the disease name recognition task. In particular, we propose various end-to-end recurrent neural network (RNN) models for the tasks of disease name recognition and their classification into four pre-defined categories. We also utilize convolution neural network (CNN) in cascade of RNN to get character-based embedded features and employ it with word-embedded features in our model. We compare our models with the state-of-the-art results for the two tasks on NCBI disease dataset. Our results for the disease mention recognition task indicate that state-of-the-art performance can be obtained without relying on feature engineering. Further the proposed models obtained improved performance on the classification task of disease names.",87,"Recurrent neural network models for disease name recognition using domain invariant features
SK Sahu, A Anand - arXiv preprint arXiv:1606.09371, 2016
Cited by 87 Related articles All 6 versions","{'2016': 2, '2017': 12, '2018': 11, '2019': 15, '2020': 18, '2021': 12, '2022': 12, '2023': 4}",,,
Relation extraction from clinical texts using domain invariant convolutional neural network,"Sunil Kumar Sahu, Ashish Anand, Krishnadev Oruganty, Mahanandeeshwar Gattu",2016/6/30,arXiv preprint arXiv:1606.09370,,,,"In recent years extracting relevant information from biomedical and clinical texts such as research articles, discharge summaries, or electronic health records have been a subject of many research efforts and shared challenges. Relation extraction is the process of detecting and classifying the semantic relation among entities in a given piece of texts. Existing models for this task in biomedical domain use either manually engineered features or kernel methods to create feature vector. These features are then fed to classifier for the prediction of the correct class. It turns out that the results of these methods are highly dependent on quality of user designed features and also suffer from curse of dimensionality. In this work we focus on extracting relations from clinical discharge summaries. Our main objective is to exploit the power of convolution neural network (CNN) to learn features automatically and thus reduce the dependency on manual feature engineering. We evaluate performance of the proposed model on i2b2-2010 clinical relation extraction challenge dataset. Our results indicate that convolution neural network can be a good model for relation exaction in clinical text without being dependent on expert's knowledge on defining quality features.",110,"Relation extraction from clinical texts using domain invariant convolutional neural network
SK Sahu, A Anand, K Oruganty, M Gattu - arXiv preprint arXiv:1606.09370, 2016
Cited by 110 Related articles All 9 versions","{'2016': 1, '2017': 14, '2018': 20, '2019': 24, '2020': 17, '2021': 15, '2022': 14, '2023': 4}",,,
Predicting online doctor ratings from user reviews using convolutional neural networks,"Ranti D Sharma, Samarth Tripathi, Sunil K Sahu, Sudhanshu Mittal, Ashish Anand",2016/4/1,International Journal of Machine Learning and Computing,6,2,IACSIT Press,"Individuals are increasingly turning to the web to seek and share healthcare information and this trend in online health information has resulted in a proliferation of user generated health centric content, especially online physician reviews. Physician rating websites can play a major role in empowering patients to make informed choices while selecting healthcare providers for advice and treatment. Given the wealth of information hidden in unstructured narratives such as online ratings, comments and clinical documents, there is a critical need for building efficient and accurate text classifiers for biomedicine corpus. In this paper, we analyze patient (dis) satisfaction using performance reviews of doctors and predict their ratings on various measures such as ‘Knowledgeability’,‘Staff’and ‘Helpfulness’. We explore solutions for the same problem using Convolutional Neural Networks trained on various optimization and loss functions. We analyze the 35000 user reviews available at “www. ratemds. com” for more than 10000 doctors. The proposed model obtained an accuracy of 93% for positive/negative binary classification of patient reviews. Moreover, we obtained a mean absolute error of 0.525 in predicting rating on a 5-point scale, thu, significantly improving upon the state of the art’s error rate of 0.71.",26,"Predicting online doctor ratings from user reviews using convolutional neural networks
RD Sharma, S Tripathi, SK Sahu, S Mittal, A Anand - International Journal of Machine Learning and …, 2016
Cited by 26 Related articles All 3 versions","{'2016': 1, '2017': 4, '2018': 3, '2019': 6, '2020': 5, '2021': 3, '2022': 4}",149,,
Inferring disease correlation from healthcare data,"Gargi Priyadarshini, Ashish Anand",2015/10/11,arXiv preprint arXiv:1510.03051,,,,"Electronic Health Records maintained in health care settings are a potential source of substantial clinical knowledge. The massive volume of data, unstructured nature of records and obligatory requirement of domain acquaintance together pose a challenge in knowledge extraction from it. The aim of this study is to overcome this challenge with a methodical analysis, abstraction and summarization of such data. This is an attempt to explain clinical observations through bio-medical and genomic data. Discharge summaries of obesity patients were processed to extract coherent patterns. This was supported by Machine Learning and Natural Language Processing based technologies and concept mapping tool along with biomedical, clinical and genomic knowledge bases. Semantic relations between diseases were extracted and filtered through Chi square test to remove spurious relations. The remaining relations were validated against biomedical literature and gene interaction networks. A collection of binary relations of diseases was derived from the data. One set implied co-morbidity while the other set contained diseases which are risk factors of others. Validation against bio-medical literature increased the prospect of correlation between diseases. Gene interaction network revealed that the diseases are related and their corresponding genes are in close proximity. Conclusion: This study focuses on deducing meaningful relations between diseases from discharge summaries. For analytical purpose, the scope has been limited to a few common, well-researched diseases. It can be extended to incorporate relatively unknown, complex diseases …",0,"Inferring disease correlation from healthcare data
G Priyadarshini, A Anand - arXiv preprint arXiv:1510.03051, 2015
Related articles All 2 versions",{},,,
Detection of highly overlapping communities in complex networks,"Madhusudan Paul, Rishav Anand, Ashish Anand",2015/9/1,Journal of Medical Imaging and Health Informatics,5,5,American Scientific Publishers,"Detecting communities in complex networks is one of the most important aspects to understand complex systems. In reality, many of these communities are highly overlapping in nature, i.e., several nodes of these communities belong to more than three communities. Identification of these communities are strongly demanded in many applications such as systems biology and social networks. Although there are algorithms for detecting overlapping communities, majority of these are unable to detect highly overlapping communities properly. The performance of these algorithms falls sharply when overlapping nodes belong to more than three communities. In this paper, we propose an extension of existing overlapping community detection algorithm, namely Greedy Clique Expansion (GCE). Due to lack of unavailability of real networks with complete information of ground-truth communities, firstly, we experiment on …",4,"Detection of highly overlapping communities in complex networks
M Paul, R Anand, A Anand - Journal of Medical Imaging and Health Informatics, 2015
Cited by 4 Related articles All 3 versions",{},1099-1103,,
