Title,Authors,Publication date,Journal,Volume,Issue,Publisher,Description,Total citations,Scholar articles,Citation Count,Pages,Source,Conference,Book
Pt: A path tracing and filtering mechanism to defend against ddos attacks,"Samant Saurabh, Ashok Singh Sairam",2011,,,,Springer Berlin Heidelberg,"Distributed Denial of Service Attack continues to plague the world. Defense against the DDoS attacks gets complicated due to IP spoofing. We propose a new packet marking technique PT (called Path Tracer) which imprints the fingerprint of the path taken by attack traffic in each packet, thereby enabling the victim to identify the attack traffic on per packet basis even in presence of IP Spoofing. Our Packet Marking Technique has many unique features. It helps the victim to proactively filter out the attack packets based on the unique path mark. A single packet contains information about complete attack path. The marking algorithm is very simple. Our approach does not create overhead in the packet and it does not require any extra storage. Analysis of our scheme proves the effectiveness of PT in filtering out DDoS traffic while allowing the legitimate traffic to be processed normally.",2,"Pt: A path tracing and filtering mechanism to defend against ddos attacks
S Saurabh, AS Sairam - Computer Networks and Intelligent Computing: 5th …, 2011
Cited by 2 Related articles All 5 versions",{},336-341,,"Computer Networks and Intelligent Computing: 5th International Conference on Information Processing, ICIP 2011, Bangalore, India, August 5-7, 2011. Proceedings",
Key Validation Using Weighted-Edge Web of Trust Model,"Sumit Kumar, Nahar Singh, Ashok Singh Sairam",2011,,,,Springer Berlin Heidelberg,"Public key cryptography is widely used in the establishment of secure communication. An important issue in the use of public key cryptography is to ensure that a public key actually belongs to its owner. This problem is referred to as the key validation problem. One solution to this key validation problem is the centralized public key infrastructure (PKI) model ([1]). A second alternative is the decentralized Web of Trust model ([2]). In this model a user depends on digital certificate introduced by other users, who may be trustworthy or otherwise, to establish the binding between a public key and its owner. In this work we propose to model the trust relationship between users as weighted edges. We propose an algorithm to find trusted paths and thus validate public keys. The proposed algorithm is simple and has a low complexity both in terms of time and space.",0,"Key Validation Using Weighted-Edge Web of Trust Model
S Kumar, N Singh, AS Sairam - … Conference, AIM 2011, Nagpur, Maharashtra, India …, 2011
Related articles All 7 versions",{},156-161,,"Information Technology and Mobile Communication: International Conference, AIM 2011, Nagpur, Maharashtra, India, April 21-22, 2011. Proceedings",
Defeating reflector based denial-of-service attacks using single packet filters,"Ashok Singh Sairam, Late Ashish Subramaniam, Gautam Barua",2010/8/25,,,,IEEE,"Denial-of-Service (DoS) and Distributed Denial-of-Service (DDoS) attacks are becoming increasingly sophisticated with few practical solutions available. In this paper we consider the issue of filtering reflector based DoS attacks and of identifying attackers. For reflector based attacks, a Signature Conflict Triggered Filtering (SCTF) scheme based on Deterministic Edge Router Marking (DERM) was proposed. We suggest an enhancement to make the 3-way handshake in SCTF stateless and call it Fast-SCTF. We then propose a framework using BGP for a single-packet handshake. We demonstrate that our proposed scheme is space efficient, more secure, robust and it requires very little cooperation among autonomous systems.",6,"Defeating reflector based denial-of-service attacks using single packet filters
AS Sairam, LA Subramaniam, G Barua - 2010 5th International ICST Conference on …, 2010
Cited by 6 Related articles All 10 versions",{},1-5,,2010 5th International ICST Conference on Communications and Networking in China,
Distributed route control schemes to load balance incoming traffic in multihomed stub networks,"Ashok Singh Sairam, Gautam Barua",2010/1/29,,,,IEEE,"Load balancing traffic of a multihomed stub network among its various egress links can significantly improve performance by allowing the network to route its traffic around congested paths. In, several centralized route control schemes to load balance traffic were proposed. It was shown that employing these route control schemes resulted in significant improvement in round-trip times. We carry this exploration further by developing distributed algorithms to load balance traffic. We show theoretically that the expected performance of the distributed version is the same as the centralized routing scheme. We further validate the schemes using both synthetic as well as actual traffic traces.",5,"Distributed route control schemes to load balance incoming traffic in multihomed stub networks
AS Sairam, G Barua - 2010 National Conference On Communications (NCC), 2010
Cited by 5 Related articles All 13 versions",{},1-5,,2010 National Conference On Communications (NCC),
Load balancing inbound traffic in multihomed stub autonomous systems,"Ashok Singh Sairam, Gautam Barua",2009/1/5,,,,IEEE,"In the Internet, with many competing networks each trying to optimise its own bandwidth, a stub network has limited knowledge about user demands, available network resources and routing policies of other networks. This uncertainty makes the task of interdomain traffic engineering for a stub network very challenging. The basic aim of a stub network connected to multiple ISPs (multihomed) is to load balance its traffic among its various edge links. Our goal in this work is to distribute the incoming traffic of a multihomed stub network among its various edge links. The focus is on networks that primarily download traffic from the Internet. Regulating the incoming traffic is difficult since it will require to influence the behaviour of the remote destinations. We performed a systematic analysis of our problem and showed that even a restricted instance of the problem is NP-complete. We proposed simple, low-cost route control …",3,"Load balancing inbound traffic in multihomed stub autonomous systems
AS Sairam, G Barua - 2009 First International Communication Systems and …, 2009
Cited by 3 Related articles All 19 versions",{},1-10,,2009 First International Communication Systems and Networks and Workshops,
Load Balancing in Multihomed Stub Networks,Ashok Singh Sairam,2009,,,,,"While there has been a steep growth in internet bandwidth, international bandwidth prices have declined sharply. This has led to a trend where large enterprises and educational in stitutes continually increase their Internet bandwidth and subscribe to more than one ISP (multihoming) to increase resilience. Higher speeds will of course mean better performance but beyond a point, the improvement in performance does not match the increase in speed. ....",1,"Load Balancing in Multihomed Stub Networks
AS Sairam - 2009
Cited by 1 Related articles All 2 versions",{'2015': 1},,,,
Effective bandwidth utilisation in multihoming networks,"Ashok Singh Sairam, Gautam Barua",2006/1/8,,,,IEEE,"In order to bridge the speed disparity at the LAN-WAN interface, enterprises install a number of policy-based devices to enforce administrative policies over the WAN access. The conventional techniques of bandwidth management concentrate only on the outgoing traffic from the local network, since that is the only traffic that can be controlled. However it is usually the incoming traffic that causes bottlenecks. This paper proposes a simple load balancing approach to optimize the use of WAN links in a multihomed environment. Incoming traffic on a link is controlled by diverting outgoing traffic from some nodes to other links. Incoming bandwidth is measured, thresholds are defined, and traffic diversion takes place to maintain the thresholds. We present a scheme to implement this. A prototype implementation has been done on an educational campus network. Preliminary experiments have shown that there are …",3,"Effective bandwidth utilisation in multihoming networks
AS Sairam, G Barua - 2006 1st International Conference on Communication …, 2006
Cited by 3 Related articles All 5 versions",{},1-8,,2006 1st International Conference on Communication Systems Software & Middleware,
Bandwidth Management using Load Balancing,"Ashok Singh Sairam, Gautam Barua",2006,,7,,,"WAN interface, enterprises install a number of policy-based devices to enforce administrative policies over the WAN access. The conventional techniques of bandwidth management concentrate only on the outgoing traffic from the local network. Regulating the outgoing traffic is easy given that the user has full control over it. However, controlling the incoming traffic is difficult since the user has no control on the traffic sent by an Internet agent. This paper proposes a simple load balancing approach to optimize the use of WAN links in a multihomed environment. By distributing the user traffic among the various WAN links we try to optimize the utilization of incoming bandwidth on the access links thereby giving an indirect measure to control the incoming traffic. We deploy a prototype implementation of our approach on a campus network with high incoming traffic, to evaluate the performance benefits. Using a large collection of network traces, we find that even with a subnet-level of load balancing there can be significant increase in performance. The proposed load balancing approach can be used as a first step toward controlling the incoming traffic, before other actual bandwidth management techniques are applied.",4,"Bandwidth Management using Load Balancing
AS Sairam, G Barua - Proc. 1st International Conf. on Communication System …, 2006
Cited by 4 Related articles All 2 versions",{},,,Proc. 1st International Conf. on Communication System Software and Middleware (COMSWARE 2006),
Managing Incoming Traffic,Ashok Singh Sairam,,,,,,"In the past few years, Internet access speeds of or-ganizations such as enterprises and educational institutions have improved significantly. However, increase in Internet speed do not necessarily translate into a proportionate increase in download performance if the traffic is not optimally distributed. In this work, we first identified that incoming traffic is the major source of congestion for network with high-content receivers. Secondly, we proposed a simple Load Balancing approach for multi-homed networks to improve Internet performance. A prototype of our scheme was implemented in an educational campus network. Finally, we propose to study our approach by scaling it to a domain network ie OSPF or IS-IS cloud, where the WAN links can be at different geographical location.",0,"Managing Incoming Traffic
AS Sairam
Related articles All 2 versions",{},,,,
