Title,Authors,Publication date,Journal,Volume,Issue,Publisher,Description,Total citations,Scholar articles,Citation Count,Pages,Source,Conference,Book
Time synchronization protocol for 6LoWPAN,"Anandghan Waghmare, Arka Prokash Mazumdar, Ashok Singh Sairam",2013/8/22,,,,IEEE,"The future is seen as place where all perceivable objects will have a layer of digital connectivity. The concept of Internet of Things involves connecting devices embedded with microcontrollers such as sensors to IP based networks. 6LoWPAN is a new set of standard for IPv6 connectivity over such low power wireless personal area networks. Time synchronization is essential in 6LoWPAN to time-align the data send by the different sensors. The other advantage of time synchronization will be to realize a perfect wake up scheme of the sensor nodes making the most of its limited power supply. Although time-synchronization has been well studied for traditional networks and to some extent in wireless sensor network, it has not been implemented for 6LoWPANs. In this paper, we propose a time synchronization protocol for 6LoWPAN. The fully functional device (FFD) does a pairwise synchronization with other …",2,"Time synchronization protocol for 6LoWPAN
A Waghmare, AP Mazumdar, AS Sairam - 2013 International Conference on Advances in …, 2013
Cited by 2 Related articles All 2 versions",{},1855-1860,,"2013 International Conference on Advances in Computing, Communications and Informatics (ICACCI)",
A more accurate completion condition for attack-graph reconstruction in Probabilistic Packet Marking algorithm,"Samant Saurabh, Ashok Singh Sairam",2013/2/15,,,,IEEE,"Probabilistic Packet Marking (PPM) is one of the most promising scheme for IP Traceback in case of DDoS attack. PPM reconstructs the attack graph in order to trace back to the attackers' network. Finding precise completion condition (i.e. number of packets required to reconstruct the attack graph) is very important. Without correct completion condition, victim might reconstruct a wrong or incomplete attack-graph. On the other extreme if it waits too long (much more than required) to collect marked packets, the real attacker would get ample time to destroy logs, traces and records and easily evade detection. Our work gives a precise completion condition for PPM that guarantees that when attack graph is reconstructed, it is correct with high probability. The main contribution of our work is - it increases the reliability and correctness of PPM algorithm and improves the chances of exact attack origin detection instead of just …",13,"A more accurate completion condition for attack-graph reconstruction in Probabilistic Packet Marking algorithm
S Saurabh, AS Sairam - 2013 National Conference on Communications (NCC), 2013
Cited by 13 Related articles All 3 versions",{},1-5,,2013 National Conference on Communications (NCC),
IP traceback in star colored networks,"Sangita Roy, Anurag Singh, Ashok Singh Sairam",2013/1/7,,,,IEEE,Network attacks and in particular denial of service (DoS) attacks have emerged as a major way to compromise the availability of servers and interrupt legitimate online services provided by servers. These attacks are among one of the hardest security problems to address because they are simple to implement but hard to prevent and difficult to trace. Tracing the attacker after an attack is crucial to institute protection measures against future attacks. Packet marking schemes have been proposed to traceback an attacker. The idea is to insert some traceback data in each packet when it passes through a router and use this information to construct the attack path. The major challenges in these schemes are to minimize the number of packets for successful traceback and to reduce the number of bits marked per packet by any router along the attack path. A general approach is to encode the 32-bit IP address of the router …,13,"IP traceback in star colored networks
S Roy, A Singh, AS Sairam - 2013 Fifth International Conference on Communication …, 2013
Cited by 13 Related articles All 7 versions",{},1-9,,2013 Fifth International Conference on Communication Systems and Networks (COMSNETS),
On performance modeling of ad hoc opportunistic routing protocols,"Arka Prokash Mazumdar, Ashok Singh Sairam",2013,Routing in Opportunistic Networks,,,Springer New York,"Since the inception of opportunistic routing in ad hoc networks, a number of OR protocols have been proposed. The performance measure of these protocols is predominantly based on simulation. Although simulation provides a simple and economical mechanism to test complex routing algorithms, they have been reported to produce inconsistent results. Simulation-based evaluation of ad hoc routing protocols should, therefore, be complemented with mathematical modeling and verification. OR protocols try to restrict the number of transmissions, therefore, the most important performance evaluation metric of OR protocols is packet transmission. In this chapter we examine the various mathematical evaluation models available in literature. During our study we found that these models do not consider retransmitted packets. We, therefore, propose an analytical model which account for packet retransmissions …",2,"On performance modeling of ad hoc opportunistic routing protocols
AP Mazumdar, AS Sairam - Routing in Opportunistic Networks, 2013
Cited by 2 Related articles All 4 versions","{'2013': 1, '2014': 1}",223-250,,,
Professors–the new YouTube stars: education through Web 2.0 and social network,"Samant Saurabh, Ashok Singh Sairam",2013/1/1,International Journal of Web Based Communities,9,2,Inderscience Publishers Ltd,"Social networking sites like Facebook, Twitter and YouTube have changed the way people live. Today we depend heavily on social networking sites for our day to day activities. This paper presents a case study where we research the effect of YouTube on education. We have studied one of YouTube’s most famous education channel called Khan Academy, founded by a MIT graduate. It has a huge collection of around 3,200 video lectures. We perform in-depth study of Khan Academy. We provide results regarding viewer-ship and popularity of these lectures by providing statistics on view count, age of videos, user comments and rating of videos. We also study viewer characteristics like age, gender and location distribution. Overall, we believe that the results presented here are crucial in understanding importance and relevance of social network for education system. The results provide valuable information to …",25,"Professors–the new YouTube stars: education through Web 2.0 and social network
S Saurabh, AS Sairam - International Journal of Web Based Communities, 2013
Cited by 25 Related articles All 4 versions","{'2013': 1, '2014': 1, '2015': 1, '2016': 2, '2017': 3, '2018': 4, '2019': 4, '2020': 2, '2021': 3, '2022': 4}",212-232,,,
Eagle Eyes: Protocol Independent Packet Marking Scheme to Filter Attack Packets and Reduce Collateral Damage During Flooding Based DoS and DDoS Attacks,"Samant Saurabh, Ashok Singh Sairam",2012/11/23,,,,IEEE,"Defences against Denial and Distributed Denial of Service (DDoS) attacks commonly responds to flooding by dropping excess traffic. Such rate limiting schemes drop all excess-traffic when the request arrival rate goes above a certain empirically calculated threshold. Flooding based DoS/DDoS attacks like TCP SYN Attack does not exhibit any special signature except that their arrival-rate is high enough to overwhelm the victim. Hence it is very difficult to differentiate between legitimate and attack traffic as they share the same signature. As a result, rate limiting schemes cause heavy collateral damage by dropping out legitimate traffic [15]. In this paper we propose a novel packet marking mechanism which not only mitigates DoS/DDoS attacks by filtering but also reduces collateral damage significantly by selectively dropping attack packets based on its packet mark while allowing the legitimate traffic to be processed …",0,"Eagle Eyes: Protocol Independent Packet Marking Scheme to Filter Attack Packets and Reduce Collateral Damage During Flooding Based DoS and DDoS Attacks
S Saurabh, AS Sairam - 2012 Third International Conference on Computer and …, 2012
Related articles All 5 versions",{},141-146,,2012 Third International Conference on Computer and Communication Technology,
Audio steganography using LSB encoding technique with increased capacity and bit error rate optimization,"Sangita Roy, Jyotirmayee Parida, Avinash Kumar Singh, Ashok Singh Sairam",2012/10/26,,,,,"Staganography is the art and science of secret hiding. The secret message or plain text may be hidden in one various ways. The methods of cryptography render the message unintelligible to the outsider by various transformations of the text whereas the methods of steganography conceal the existence of the message. To conceal a secret message we need a wrapper or container as a host file. Different wrappers or host files or cover medium are used to hide the secret message e.g. image, audio, video, text. The work in this paper aims at enhancing the provision of audio steganography by introducing one LSB (Least Significant Bit) coding technique. We design a high bit rate LSB audio watermarking method that reduces embedding distortion of the host audio with increased capacity of secret text. By using standard and proposed algorithm, watermark bits are embedded into higher LSB layer, resulting in increased …",16,"Audio steganography using LSB encoding technique with increased capacity and bit error rate optimization
S Roy, J Parida, AK Singh, AS Sairam - Proceedings of the Second International Conference …, 2012
Cited by 16 Related articles All 3 versions",{},372-376,,,"Proceedings of the Second International Conference on Computational Science, Engineering and Information Technology"
A novel approach to prevent sql injection attack using url filter,"Sangita Roy, Avinash Kumar Singh, Ashok Singh Sairam",2012/10/1,"International Journal of Innovation, Management and Technology",3,5,IACSIT Press,"Web services are usually supported by a database at the backend while a frontend takes input from the user, construct SQL statements and access the database. SQL injection is a popular technique used by attackers to exploit unsanitized user input vulnerability by convincing the application to run SQL code that it was not intended to run. Validating all user inputs and checking for vulnerability can be tedious on the part of the programmer. In this work we propose a new approach to prevent SQL injection attack using URL filtering. URL filters are used to validate user input to web forms. In this approach a single filter can be used to validate input to several databases which makes our approach more scalable and efficient. We implement the filter using Java servlet and demonstrate its effectiveness.",4,"A novel approach to prevent sql injection attack using url filter
S Roy, AK Singh, AS Sairam - International Journal of Innovation, Management and …, 2012
Cited by 4 Related articles All 6 versions",{},499,,,
On energy consumption analysis for ad hoc routing protocols,"Vishwanath Pratap Singh, Arka Prokash Mazumdar, Ashok Singh Sairam",2012/8/3,,,,,"The presence of untethered nodes and lack of backbone infrastructure in ad-hoc wireless networks makes energy a very critical resource. In this work we analyze the energy consumption during the various stages of routing - route discovery, message transmission and route maintenance. Since the routing strategies differ widely for different routing protocols we study some representative routing protocols. We examine the reactive protocols AODV and DSR and in the case of proactive protocols we examine OLSR and DSDV. Our analysis takes into account the wake-up schemes. For our analytical model to compute the total energy consumption we need the energy consumed by a node during transmission, reception or while it is idle. To obtain this values we simulated the protocols using ns-2. The experimental results were in conformance with the theoretical behaviour of the routing models.",0,"On energy consumption analysis for ad hoc routing protocols
VP Singh, AP Mazumdar, AS Sairam - Proceedings of the International Conference on …, 2012
Related articles",{},300-306,,,"Proceedings of the International Conference on Advances in Computing, Communications and Informatics"
Genetic algorithm combined with support vector machine for building an intrusion detection system,"Sriparna Saha, Ashok Singh Sairam, Amulya Yadav, Asif Ekbal",2012/8/3,,,,,"In this paper, we develop an intrusion detection system (IDS) based on machine learning. We employ genetic algorithm (GA) along with Support Vector Machine (SVM) for automatically determining the appropriate set of features. The idea is then developed into a fully functional IDS. Experiments of testing the IDS on the benchmark KDD CUP 99 datasets are presented. Results show encouraging performance that opens a avenue for further research.",27,"Genetic algorithm combined with support vector machine for building an intrusion detection system
S Saha, AS Sairam, A Yadav, A Ekbal - Proceedings of the International Conference on …, 2012
Cited by 27 Related articles All 3 versions",{},566-572,,,"Proceedings of the International Conference on Advances in Computing, Communications and Informatics"
Opportunistic routing: opportunities and challenges,"Arka Prokash Mazumdar, Ashok Singh Sairam",2012/3/1,,2,2,IACSIT Press,"(OR) gained a lot of attention as a way to improve the performance of wireless multi-hop Ad-hoc networks and wireless sensor networks. OR takes advantage of the broadcast nature of wireless communications to improve transmission reliability and throughput by forwarding data through a set of paths instead of one best path. In this paper we demonstrate the efficacy of OR by comparing it with traditional wireless routing protocols. Concurrently we also outline several vital design issues that needs to be considered by OR protocols to make it more effective and deployable. Finally, based on our extensive analysis we provide a generic framework to develop OR protocols for wireless ad-hoc and sensor networks.",5,"Opportunistic routing: opportunities and challenges
AP Mazumdar, AS Sairam - International Journal of Information and Electronics …, 2012
Cited by 5 Related articles All 3 versions",{},247,International Journal of Information and Electronics Engineering,,
Linear and remainder packet marking for fast IP traceback,"Samant Saurabh, Ashok Singh Sairam",2012/1/3,,,,IEEE,"Several packet marking schemes have been proposed for DoS/DDoS defence to trace back the attackers to their source. One of the major challenge in design of efficient traceback scheme is to minimize the number of packets required for successful traceback. DDoS attacks are becoming highly distributed and increasingly sophisticated. Even though the net sum of attack packets is high enough to overwhelm the resources at the victim, number of packets originating from individual sources is not so high. Hence in order for traceback scheme to be efficient in tracing in case of DDoS attacks, traceback scheme should require minimal number of packets from the attacker to perform IP Traceback. In this paper we propose a novel packet marking scheme called Linear Packet Marking (LPM) which requires number of packets which is equal to hop distance between attacker and the victim which is less than 31 [5]. We also …",26,"Linear and remainder packet marking for fast IP traceback
S Saurabh, AS Sairam - … Conference on Communication Systems and Networks …, 2012
Cited by 26 Related articles All 4 versions",{},1-8,,2012 Fourth International Conference on Communication Systems and Networks (COMSNETS 2012),
PBFS: A Technique to Select Forwarders in Opportunistic Routing,"AS Sairam, AK Mazumdar",2012,,,,IEEE Xplore,"Opportunistic Routing (OR) is a class of routing protocol that exploits the broadcast nature of wireless network to improve routing efficiency. The primary step in OR is to select a group of nodes as forwarders and prioritize them. The current approach of selecting the forwarders is through simulation which does not always give the best results, select forwarders on diverse paths and can be compute intensive for large networks. In this paper we formulate the problem using OR algebra. We propose a forwarder selection scheme primary-brook forwarder selection (PBFS) that computes the forwarder list such that a particular network objective is maximized. The main criteria while selecting the forwarders is to ensure that adjacent forwarders can listen to each other. Analytical as well as empirical results show that our scheme requires less number of retransmission as compared to some of the popular OR protocols.",0,"PBFS: A Technique to Select Forwarders in Opportunistic Routing
AS Sairam, AK Mazumdar - 2012",{},,,,
Audio Steganography Using LSB Encoding Technique with Increased Capacity and Bit Error Rate Optimization,"AS Sairam, J Parida, AK Singh, S Roy",2012,,,,ACM Digital Library,"Staganography is the art and science of secret hiding. The secret message or plain text may be hidden in one various ways. The methods of cryptography render the message unintelligible to the outsider by various transformations of the text whereas the methods of steganography conceal the existence of the message. To conceal a secret message we need a wrapper or container as a host file. Different wrappers or host files or cover medium are used to hide the secret message e.g. image, audio, video, text. The work in this paper aims at enhancing the provision of audio steganography by introducing one LSB (Least Significant Bit) coding technique. We design a high bit rate LSB audio watermarking method that reduces embedding distortion of the host audio with increased capacity of secret text. By using standard and proposed algorithm, watermark bits are embedded into higher LSB layer, resulting in increased …",0,"Audio Steganography Using LSB Encoding Technique with Increased Capacity and Bit Error Rate Optimization
AS Sairam, J Parida, AK Singh, S Roy - 2012",{},,,,
PBFS: a technique to select forwarders in Opportunistic Routing,"Arka Prokash Mazumdar, Ashok Singh Sairam",2011/11/21,,,,IEEE,"Opportunistic Routing (OR) is a class of routing protocol that exploits the broadcast nature of wireless network to improve routing efficiency. The primary step in OR is to select a group of nodes as forwarders and prioritize them. The current approach of selecting the forwarders is through simulation which does not always give the best results, select forwarders on diverse paths and can be compute intensive for large networks. In this paper we formulate the problem using OR algebra. We propose a forwarder selection scheme primary-brook forwarder selection (PBFS) that computes the forwarder list such that a particular network objective is maximized. The main criteria while selecting the forwarders is to ensure that adjacent forwarders can listen to each other. Analytical as well as empirical results show that our scheme requires less number of retransmission as compared to some of the popular OR protocols.",7,"PBFS: a technique to select forwarders in Opportunistic Routing
AP Mazumdar, AS Sairam - TENCON 2011-2011 IEEE Region 10 Conference, 2011
Cited by 7 Related articles All 3 versions",{},149-153,,TENCON 2011-2011 IEEE Region 10 Conference,
FC-DERM: Fragmentation compatible deterministic edge router marking,"Samant Saurabh, Ashok Singh Sairam",2011/10/2,,,,IEEE,"Distributed Denial-of-Service (DDoS) attacks are one of the major threats the Internet is facing today. The problem of tracing the attackers is particularly difficult since attackers spoof the source addresses. Researchers all over the world have proposed several packet marking based techniques for DDoS attack mitigation using IP Traceback, however even after a decade of active research no commercial product incorporates any of these packet marking techniques; either because they add overhead in network traffic or they break some of the existing internet features like IP fragmentation. In this paper, we propose a novel scheme which performs IP Traceback but adds no space overhead and yet is fragmentation compatible. We show that our scheme produces negligible false positive and causes almost no collision in ID field for fragmentation and reassembly. As this scheme is simple to implement and has very less …",1,"FC-DERM: Fragmentation compatible deterministic edge router marking
S Saurabh, AS Sairam - The 17th Asia Pacific Conference on Communications, 2011
Cited by 1 Related articles All 3 versions",{'2016': 1},800-805,,The 17th Asia Pacific Conference on Communications,
Detecting and defeating SQL injection attacks,"Sangita Roy, Avinash Kumar Singh, Ashok Singh Sairam",2011/7/1,International Journal of Information and Electronics Engineering,1,1,IACSIT Press,"The increasing dependence on web applications have made them a natural target for attackers. Among these attacks SQL Injection Attacks (SQLIA) are the most prevalent. In this paper we propose a SQL injection vulnerability scanner that is light-weight, fast and has a low false positive rate. These scanners prove as a practical tool to discover the vulnerabilities in a web application as well as to test the efficiency of counter attack mechanisms. In the latter part of our work we propose a security mechanism to counter SQL Injection Attacks. Our security methodology is based on the design of a filter for the HTTP request send by clients or users and look for attack signatures. The proposed filter is generic in the sense that it can be used with any web application. Finally we test our proposed security mechanism using the vulnerability scanner developed by us as well as other well known scanners. The proposed security mechanism is able to counter all the vulnerabilities that were previously reported before the deployment of our security framework.",20,"Detecting and defeating SQL injection attacks
S Roy, AK Singh, AS Sairam - International Journal of Information and Electronics …, 2011
Cited by 20 Related articles All 8 versions","{'2014': 1, '2015': 3, '2016': 1, '2017': 3, '2018': 3, '2019': 5, '2020': 1, '2021': 1, '2022': 1}",38,,,
Analyzing SQL Meta characters and preventing SQL Injection attacks using meta filter,"Sangita Roy, Avinash Kumar Singh, Ashok Singh Sairam",2011/5/28,"International Conference on Information and Electronics Engineering, ICIEE 2011, IACSIT Press",6,,,SQL injection attacks (SQLIA) are widely used in which an attacker crafts input to the application server to access or modify data on the database server. A common approach for an attacker to launch SQLIA is by modifying the input URL to contain partial SQL queries and trick the server into executing them. In this paper we first identify all those input patterns that can appear in the URL of an attack. Next we proposed to deploy a SQL Meta character filter that parses the input URL to detect attack patterns. The attack patterns are so chosen so that SQL Meta characters that appear in a legal input are not filtered out. We implement the filter using Java servlet and demonstrate its effectiveness.,9,"Analyzing SQL Meta characters and preventing SQL Injection attacks using meta filter
S Roy, AK Singh, AS Sairam - … on Information and Electronics Engineering, ICIEE …, 2011
Cited by 9 Related articles All 5 versions",{},167-170,,,
Global Distributed Indexing for In-Network Storage in Sensor Networks,"Samant Saurabh, Shashi Shekhar Singh, Ashok Singh Sairam",2011,,,,Springer Berlin Heidelberg,"The Introduction of energy-efficient flash memory has greatly facilitated archival storage of sensor data that is necessary for applications that query, mine, and analyze such data for interesting features and trends. This trend has necessitated the need for a global distributed index for in-network storage in power constrained sensor networks. We propose and evaluate the architecture for such networks and a distributed indexing for the architecture that allows distributed queries to proceed in a fault-tolerant and energy efficient manner with low latency. We discuss the rationale behind the choice of our indexing scheme and evaluate some of the characteristics of the scheme.",0,"Global Distributed Indexing for In-Network Storage in Sensor Networks
S Saurabh, SS Singh, AS Sairam - Computer Networks and Intelligent Computing: 5th …, 2011
Related articles All 5 versions",{},428-437,,"Computer Networks and Intelligent Computing: 5th International Conference on Information Processing, ICIP 2011, Bangalore, India, August 5-7, 2011. Proceedings",
