Title,Authors,Publication date,Journal,Volume,Issue,Publisher,Description,Total citations,Scholar articles,Citation Count,Pages,Conference,Source,Inventors,Patent office,Patent number,Application number,Institution
A Hand Gesture-operated System for Rehabilitation using an End-to-End Detection Framework,"H Pallab Jyoti Dutta, MK Bhuyan, Debanga Raj Neog, Karl F MacDorman, RH Laskar",2023/3/2,IEEE Transactions on Artificial Intelligence,,,IEEE,"We propose a hand gesture-operated system as an AI application to relieve discomfort and restore function in hand and arm movements caused by injuries and nerve and muscle complications. The system trains patients with hand exercises, such as performing hand gestures accurately, traversing within specified bounds, and operating a hand gesture calculator. However, the system requires accurate hand gesture detection, which is impeded by background clutter and variations in illumination and in the hand's size and angle. To address this, we developed a robust hand detection module that uses a single-stage transformer deep network. The transformer network encodes global information and uses bipartite matching to reduce the frequency of spurious detections. It drives a regression head and a classification head to localize the hand gesture in a bounding box and assign it a class label. Hand keypoints are …",0,"A Hand Gesture-operated System for Rehabilitation using an End-to-End Detection Framework
HPJ Dutta, MK Bhuyan, DR Neog, KF MacDorman… - IEEE Transactions on Artificial Intelligence, 2023
All 2 versions",{},,,,,,,,
Retinal vessel segmentation using multi-scale residual convolutional neural network (MSR-Net) combined with generative adversarial networks,"Mithun Kumar Kar, Debanga Raj Neog, Malaya Kumar Nath",2023/2,"Circuits, Systems, and Signal Processing",42,2,Springer US,"Retinal fundus images provide valuable diagnostic and clinical information in the diagnosis of ophthalmologic diseases. Retinal blood vessel analysis provides important diagnostic information about thinning of the retinal nerve fiber layer and alteration in the structural appearance of the optic nerve head. Here, an accurate retinal vessel detection method is proposed from fundus images using a generative adversarial network (GAN) utilizing multiple loss functions. The proposed GAN architecture consists of the generator as a segmentation network and the discriminator as a classification network. The generator is a multi-scale residual convolutional neural network with skip connection and up-sampling, while the discriminator is a vision transformer that acts as a binary classifier. The inception module extracts multi-scale features of vessel segments from different scales and captures fine vessel segments. The …",4,"Retinal vessel segmentation using multi-scale residual convolutional neural network (MSR-Net) combined with generative adversarial networks
MK Kar, DR Neog, MK Nath - Circuits, Systems, and Signal Processing, 2023
Cited by 4 Related articles",{'2023': 4},1206-1235,,,,,,,
A Conceptual Framework for the Development of Chatbots Addressing COVID-19 Vaccine Hesitancy,"Debanga R. Neog, Rhythm Grover, Ramdas Ransing, Rodrigo Ramalho",2022/12,I. P. Pavlov Russian Medical Biological Herald,30,4,https://journals.eco-vector.com/pavlovj/article/view/91196,,0,"A Conceptual Framework for the Development of Chatbots Addressing COVID-19 Vaccine Hesitancy*
ND Raj, R Ramdas, R Rodrigo - … медико-биологический вестник имени академика ИП …, 2022
Related articles All 2 versions",{},,,,,,,,
Two-Stage Hand Gesture Recognition based on Hand Keypoints Localization,"Debanga Raj Neog, MK Bhuyan, Mousumi Das, RH Lashkar",2022/3/24,,,,IEEE,"Hand gesture is an important component of non-verbal communication, and the appropriate categorization of the gestures is quintessential for fruitful communication. Hand gestures are used in many human-computer interfaces for their natural and simplistic contactless way of conveying instruction to the interface. However, the recognition of hand gestures is complicated by numerous factors. This paper addresses a few issues by proposing a two-stage recognition framework that uses a hand joint localization technique. Firstly, the proposed method predicts hand keypoints that localize the region of interest by encompassing the hand region through a bounding box. Subsequently, this region of interest is used in gesture recognizing. The proposed work uses only one input modality-RGB image and performs phenomenally despite background clutter and illumination variation.",0,"Two-Stage Hand Gesture Recognition based on Hand Keypoints Localization
DR Neog, MK Bhuyan, M Das, RH Lashkar - … on Wireless Communications Signal Processing and …, 2022
Related articles",{},110-114,2022 International Conference on Wireless Communications Signal Processing and Networking (WiSPNET),,,,,,
Contextual emotion learning challenge,"Jainendra Shukla, Puneet Gupta, Aniket Bera, Arka Sarkar, Prakhar Goel, Shubhangi Butta, Anup Kumar Gupta, Snehil Sanyal, Debanga Rai Neog, MK Bhuyan, Kalyani Marathe, Linda Shapiro, Alex Colbrn, Varchita Lalwani",2021/12/15,,,,IEEE,"Emotion recognition via vision has been deeply associated with facial expressions, and the inference of emotions has, more often than not, been based on the same. However, context, both environmental and social, plays an imperative role in emotion recognition but has not been incorporated widely so far. The meaning of emotion might entirely switch when shifted from one setting to another if only facial expressions are taken into account. Moreover, there exists no study in the Indian context about the same. To cater to this issue, we generate and introduce the Indian Contextual Emotion Recognition (ICER) dataset based on the multi-ethnic Indian context. This paper summarises the Contextual Emotion Learning Challenge (CELC 2021) organized in conjunction with the 16th IEEE Conference on Automatic Face and Gesture Recognition (FG) 2021. We outline the tasks posed in the challenge, the novel dataset …",1,"Contextual emotion learning challenge
J Shukla, P Gupta, A Bera, A Sarkar, P Goel, S Butta… - 2021 16th IEEE International Conference on Automatic …, 2021
Cited by 1 Related articles All 4 versions",{'2023': 1},1-7,2021 16th IEEE International Conference on Automatic Face and Gesture Recognition (FG 2021),,,,,,
A review on progress in semantic image segmentation and its application to medical images,"Mithun Kumar Kar, Malaya Kumar Nath, Debanga Raj Neog",2021/9,,2,5,Springer Singapore,"Semantic image segmentation is a popular image segmentation technique where each pixel in an image is labeled with an object class. This technique has become a vital part of image analysis nowadays as it facilitates the description, categorization, and visualization of the regions of interest in an image. The recent developments in computer vision algorithms and the increasing availability of large datasets have made semantic image segmentation very popular in the field of computer vision. Motivated by the human visual system which can identify objects in a complex scene very efficiently, researchers are interested in building a model that can semantically segment an image into meaningful object classes. This paper reviews deep learning-based semantic segmentation techniques that use deep neural network architectures for image segmentation of biomedical images. We have provided a discussion …",10,"A review on progress in semantic image segmentation and its application to medical images
MK Kar, MK Nath, DR Neog - SN computer science, 2021
Cited by 10 Related articles All 3 versions","{'2022': 6, '2023': 4}",397,,SN computer science,,,,,
Transfer Learning in Deep Neural Networks,"Debanga Raj Neog, Prithu Banerjee, Ritika Jain",2020,,,,,"In the traditional machine learning approaches of obtaining models from data, there is an inherent assumption that the training data and the future data both lie in the same feature space and have the same distribution. However, in many real world applications like medicine, where training data is very scarce or difficult to obtain; model acquisition becomes a challenge. For instance, we may have a classification task in one domain of interest whereas sufficient training data is available in a different domain of interest. The latter domain may have a different feature space or follow a different distribution from the one we are interested in. In such cases, carrying forward the structural properties of a model learned in a source domain where training data is ample and reusing it partially or fully in a target domain can save us expensive data-labeling efforts. In recent years, transfer learning has emerged as a new learning approach and this survey focuses on various DNN architectures, different training methods adopted to train those and their performance in several application domains.",1,"Transfer Learning in Deep Neural Networks
DR Neog, P Banerjee, R Jain - 2020
Cited by 1 Related articles All 2 versions",{'2020': 1},,,,,,,,
The human touch: Measuring contact with real human soft tissues,"Dinesh K Pai, Austin Rothwell, Pearson Wyder-Hodge, Alistair Wick, Ye Fan, Egor Larionov, Darcy Harrison, Debanga Raj Neog, Cole Shing",2018/7/30,ACM Transactions on Graphics (TOG),37,4,ACM,"Simulating how the human body deforms in contact with external objects, tight clothing, or other humans is of central importance to many fields. Despite great advances in numerical methods, the material properties required to accurately simulate the body of a real human have been sorely lacking. Here we show that mechanical properties of the human body can be directly measured using a novel hand-held device. We describe a complete pipeline for measurement, modeling, parameter estimation, and simulation using the finite element method. We introduce a phenomenological model (the sliding thick skin model) that is effective for both simulation and parameter estimation. Our data also provide new insights into how the human body actually behaves. The methods described here can be used to create personalized models of an individual human or of a population. Consequently, our methods have many …",26,"The human touch: Measuring contact with real human soft tissues
DK Pai, A Rothwell, P Wyder-Hodge, A Wick, Y Fan… - ACM Transactions on Graphics (TOG), 2018
Cited by 26 Related articles All 4 versions","{'2018': 1, '2019': 6, '2020': 8, '2021': 5, '2022': 5, '2023': 1}",1-12,,,,,,,
Methods and systems for computer-based skin animation,,2018/7/3,,,,,"A method for simulating movement of a skin associated with a body comprises maintaining, by a computer, a representation of the skin comprising vertices, each vertex of the representation corresponding to a material point of the skin and comprising associated data, the associated data for each vertex comprising: constant body coordinates which represent a location of the material point of the skin relative to the body; and Eulerian skin coordinates specifying which one or more reference skin coordinates from among a set of reference skin coordinates correspond to the vertex at a particular time. Body coordinates and Eulerian skin coordinates may be maintained in two-dimensional spaces, which parameterize the surface of the body and skin.",8,"Methods and systems for computer-based skin animation
D Pai, LI Duo, S Sueda, N Debanga - US Patent 10,013,792, 2018
Cited by 8 Related articles All 4 versions",{},,,,"Dinesh Pai, LI Duo, Shinjiro Sueda, NEOG Debanga",US,10013792,14901326,
Measurement and animation of the eye region of the human face in reduced coordinates,Debanga Raj Neog,2018,,,,,"The goal of this dissertation is to develop methods to measure, model, and animate facial tissues of the region around the eyes, referred to as the eye region. First, we measure the subtle movements of the soft tissues of the eye region using a monocular RGB-D camera setup, and second, we model and animate these movements using parameterized motion models. The muscles and skin of the eye region are very thin and sheetlike. By representing these tissues as thin elastic sheets in reduced coordinates, we have shown how we can measure and animate these tissues efficiently. To measure tissue movements, we optically track both eye and skin motions using monocular video sequences. The key idea here is to use a reduced coordinates framework to model thin sheet-like facial skin of the eye region. This framework implicitly constrains skin to conform to the shape of the underlying object when it slides. The skin configuration can then be efficiently reconstructed in 3D by tracking two dimensional skin features in video. This reduced coordinates model allows interactive real-time animation of the eye region in WebGL enabled devices using a small number of animation parameters, including gaze. Additionally, we have shown that the same reduced coordinates framework can also be used for physics-based simulation of the facial tissue movements and to produce tissue deformations that occur in facial expressions. We validated our skin measurement and animation algorithms using skin movement sequences with known skin motions, and we can recover skin sliding motions with low reconstruction errors. We also propose an image-based …",1,"Measurement and animation of the eye region of the human face in reduced coordinates
DR Neog - 2018
Cited by 1 Related articles",{'2020': 1},,,,,,,,University of British Columbia
Seeing Skin in Reduced Coordinates,"Debanga R Neog, Anurag Ranjan, Dinesh K Pai",2017/5/30,,,,IEEE,"We present a skin tracking and reconstruction method that uses a monocular camera and a depth sensor to recover skin sliding motions on the surface of a deforming object. Such depth cameras are widely available. Our key idea is to use a reduced coordinate framework that implicitly constrains skin to conform to the shape of the underlying object when it slides. The skin configuration in 3D can then be efficiently reconstructed by tracking two dimensional skin features in video. This representation is well suited for tracking subtle skin movements in the upper face and on the hand. The reconstructed skin motions have many uses, including synthesizing and retargeting animations, recognizing facial expressions, and for learning datadriven models of skin movement. In our face tracking examples, we recover subtle but important details of skin movement around the eyes. We validated the algorithm using a hand …",0,"Seeing Skin in Reduced Coordinates
DR Neog, A Ranjan, DK Pai - 2017 12th IEEE International Conference on Automatic …, 2017
Related articles All 3 versions",{},484-489,2017 12th IEEE International Conference on Automatic Face & Gesture Recognition (FG 2017),,,,,,
Atelier HAL: le nouveau dépôt simplifié (24/10/17),"Armelle Bauer, Debanga Raj Neog, Ali-Hamadi Dicko, Dinesh K Pai, François Faure",2017,Évolution,82,,,,0,"Ateliers"" Aide à la production de liste des publications de l'unité""(21/01/2019)*
HAL Guide - Évolution",{},069,,,,,,,
Anatomical Augmented Reality with 3D Commodity Tracking and Image-space Alignment,"Jocelyne Troccaz Armelle Bauer, Debanga Raj Neog, Ali-Hamadi Dicko, Dinesh K. Pai, Fran\c{c}ois Faure, Olivier Palombi",2017,Computers and Graphics,,,Elsivier,"This paper presents a mirror-like augmented reality (AR) system to display the internal anatomy of the current user. Using a single Microsoft V2.0 Kinect (later on referenced as the Kinect), we animate in real-time a user-specific model of internal anatomy according to the user’s motion and we superimpose it onto the user’s color map. Users can visualize their anatomy moving as if they where looking inside their own bodies in real-time.
A new calibration procedure to set up and attach a user-specific anatomy to the Kinect body tracking skeleton is introduced. At calibration time, the bone lengths are estimated using a set of poses. By using Kinect data as input, the practical limitation of skin correspondence in prior work is overcome. The generic 3D anatomical model is attached to the internal anatomy registration skeleton, and warped on the depth image using a novel elastic deformer subject to a closest-point …",20,"Anatomical augmented reality with 3D commodity tracking and image-space alignment
A Bauer, DR Neog, AH Dicko, DK Pai, F Faure… - Computers & Graphics, 2017
Cited by 20 Related articles All 13 versions
METEO Archive ouverte HAL Météo-France*
R Conformité","{'2017': 1, '2018': 2, '2019': 5, '2020': 1, '2021': 7, '2022': 2, '2023': 2}",,,,,,,,
[BEST PAPER AWARD] Interactive gaze driven animation of the eye region,"Debanga R Neog, João L Cardoso, Anurag Ranjan, Dinesh K Pai",2016/7/22,,,,ACM,"We propose a system for real-time animation of eyes that can be interactively controlled in a WebGL enabled device using a small number of animation parameters, including gaze. These animation parameters can be obtained using traditional keyframed animation curves, measured from an actor's performance using off-the-shelf eye tracking methods, or estimated from the scene observed by the character, using behavioral models of human vision. We present a model of eye movement, that includes not only movement of the globes, but also of the eyelids and other soft tissues in the eye region. The model includes formation of expression wrinkles in soft tissues. To our knowledge this is the first system for real-time animation of soft tissue movement around the eyes based on gaze input.",10,"Interactive gaze driven animation of the eye region
DR Neog, JL Cardoso, A Ranjan, DK Pai - Proceedings of the 21st International Conference on …, 2016
Cited by 10 Related articles All 3 versions","{'2017': 3, '2018': 1, '2019': 2, '2020': 1, '2021': 1, '2022': 1}",51-59,Proceedings of the 21st International Conference on Web3D Technology,,,,,,
Biomechanical Modeling and Control of Facial Muscles,"Debanga R. Neog, Dinesh K. Pai",2016/6,,,,,,0,,{},,NorthWest Biomechanics Symposium 2016 UBC,,,,,,
Transfer Learning in Deep Neural Networks,"Ritika Jain Debanga Raj Neog, Prithu Banerjee",2016,,,,https://drive.google.com/open?id=1gL_Rj4RtZyHuL3f8pLGzqeBKO47dM29b,,0,,{},,UBC CPSC 540 Project Paper,,,,,,
Gaze Driven Animation of Eyes,"Debanga Neog, A Ranjan, J. L. Cardoso, D. K. Pai",2015/8,Proceedings of the 14th ACM SIGGRAPH / Eurographics Symposium on Computer Animation,14,http://dl.acm.org/citation.cfm?id=279514,"ACM New York, NY, USA ©2015","We present a data driven model of eye movement, that includes movement of the globes, the periorbital soft tissues and eyelids and also the formation of wrinkles in the tissues. We describe a pipeline for measurement and estimation of tissue movement around the eyes using monocular high speed video capture. We use dense optical flow techniques to simultaneously estimate skin and globe motion, as well as high resolution texture images. Our methods are robust to transient occlusions. Finally, we present a system for interactive animation of eyes using a small number of animation parameters, including gaze. These parameters can be obtained from any source, such as keyframe animation or an actor's performance.",2,"Gaze driven animation of eyes
DR Neog, A Ranjan, JL Cardoso, DK Pai - Proceedings of the 14th ACM SIGGRAPH …, 2015
Cited by 2 Related articles All 5 versions",{},198,,,,,,,
Hand pose recognition from monocular images by geometrical and texture analysis,"Manas Kamal Bhuyan, Karl F MacDorman, Mithun Kumar Kar, Debanga Raj Neog, Brian C Lovell, Prathik Gadde",2015/6/1,Journal of Visual Languages & Computing,28,,Academic Press,"One challenging research problem of hand pose recognition is the accurate detection of finger abduction and flexion with a single camera. The detection of flexion movements from a 2D image is difficult, because it involves estimation of finger movements along the optical axis of the camera (z direction). In this paper, a novel approach to hand pose recognition is proposed. We use the concept of object-based video abstraction for segmenting the frames into video object planes (VOPs), as used in MPEG-4, with each VOP corresponding to one semantically meaningful hand position. Subsequently, a particular hand pose is recognized by analyzing the key geometrical features and the textures of the hand. The abduction and adduction movements of the fingers are analyzed by considering a skeletal model. Probabilistic distributions of the geometric features are considered for modeling intra-class abduction and …",27,"Hand pose recognition from monocular images by geometrical and texture analysis
MK Bhuyan, KF MacDorman, MK Kar, DR Neog… - Journal of Visual Languages & Computing, 2015
Cited by 27 Related articles All 7 versions",{},39-55,,,,,,,
Biomechanical Modeling and Measurement of Eyelid Movement,"Debanga Neog, Dinesh Pai",2013/7,,,,,,0,,{},,Gordon Research Conference on Eye Movement,,,,,,
Thin Skin Elastodynamics,"Duo Li, Shinjiro Sueda, Debanga Raj Neog, Dinesh Pai",2013/7,ACM Transaction on Graphics,32,4,ACM,"We present a novel approach for simulating thin hyperelastic skin. Real human skin is only a few millimeters thick. It can stretch and slide over underlying body structures such as muscles, bones, and tendons, revealing rich details of a moving character. Simulating such skin is challenging because it is in close contact with the body and shares its geometry. Despite major advances in simulating elastodynamics of cloth and soft bodies for computer graphics, such methods are difficult to use for simulating thin skin due to the need to deal with non-conforming meshes, collision detection, and contact response. We propose a novel Eulerian representation of skin that avoids all the difficulties of constraining the skin to lie on the body surface by working directly on the surface itself. Skin is modeled as a 2D hyperelastic membrane with arbitrary topology, which makes it easy to cover an entire character or object. Unlike most …",71,"Thin skin elastodynamics
D Li, S Sueda, DR Neog, DK Pai - ACM Transactions on Graphics (TOG), 2013
Cited by 71 Related articles All 3 versions","{'2014': 5, '2015': 11, '2016': 8, '2017': 8, '2018': 7, '2019': 13, '2020': 8, '2021': 4, '2022': 3}",,,,,,,,
Generating lambertian image with uniform reflectance for endoscope image,"Yuki Shimasaki, Yuji Iwahori, Debanga Raj Neog, Robert J Woodham, MK Bhuyan",2013/1,IWAIT2013,,,,"It is an important topic to recognize polyp from the endoscope image via medical diagnosis. Many approaches have been proposed for the shape recovery for Lambertian reflectance as shape-from-shading problem, while the previous approaches [1][2] treats the actual endoscope image which includes specular reflectance with various color reflectances. Some approaches have been proposed to remove the specular reflectance components.[3] separates diffuse component and specular component from an image taken by a camera with polarizing plate, while [4] tries to generate diffuse component image by removing specular component by taking images of an object from multiple view points.[5] developed a method to convert the original image to Lambertian image using object rotation. Endoscope environment cannot use the polarizing plate, object rotation and multiple images with different view points for the problem of both camera motion and peristaltic movement of object inside body. Previous researches [1][2] proposed approaches to recover 3-D shape of polyp from observed endoscope image with generating diffuse component image by removing specular component.[1][2] has some limitation to the monocular convex object based on the condition of point light source illumination and perspective projection as an extended approach of FMM (Fast Marching Method) to SFS problem proposed by [6]. FMM can be applied to recover the 3-D shape in general but it can be applied to uniform Lambertian reflectance object. So, this paper also aims to generate a uniform diffused reflectance surface from the multicolored image including the …",17,"Generating lambertian image with uniform reflectance for endoscope image
Y Shimasaki, Y Iwahori, DR Neog, RJ Woodham… - IWAIT2013, 2013
Cited by 17 Related articles All 2 versions",{},1-6,,,,,,,
Eyecatch: Simulating visuomotor coordination for object interception,"Sang Hoon Yeo, Martin Lesmana, Debanga R Neog, Dinesh K Pai",2012/7/1,ACM Transactions on Graphics (TOG),31,4,ACM,"We present a novel framework for animating human characters performing fast visually guided tasks, such as catching a ball. The main idea is to consider the coordinated dynamics of sensing and movement. Based on experimental evidence about such behaviors, we propose a generative model that constructs interception behavior online, using discrete submovements directed by uncertain visual estimates of target movement. An important aspect of this framework is that eye movements are included as well, and play a central role in coordinating movements of the head, hand, and body. We show that this framework efficiently generates plausible movements and generalizes well to novel scenarios.",74,"Eyecatch: Simulating visuomotor coordination for object interception
SH Yeo, M Lesmana, DR Neog, DK Pai - ACM Transactions on Graphics (TOG), 2012
Cited by 74 Related articles All 9 versions","{'2012': 1, '2013': 4, '2014': 7, '2015': 13, '2016': 7, '2017': 8, '2018': 14, '2019': 6, '2020': 5, '2021': 5, '2022': 4}",1-10,,,,,,,
A model of visuomotor coordination and submovements in three dimensional object interception,"D. K. Pai S. -H. Yeo, M. Lesmana, D. R. Neog",2012/4,"Neural Control of Movement Meeting, Venice, Italy",,40,,,0,,{},,,,,,,,
