Title,Authors,Publication date,Journal,Volume,Issue,Publisher,Description,Total citations,Scholar articles,Citation Count,Pages,Conference,Source,Inventors,Patent office,Patent number,Application number,Institution
Fingertip detection for hand pose recognition,"MK Bhuyan, Debanga Raj Neog, Mithun Kumar Kar",2012/3/1,International Journal on Computer Science and Engineering,4,3,Engg Journals Publications,"In this paper, a novel algorithm is proposed for fingertip detection and finger type recognition.
The algorithm is applied for locating fingertips in hand region extracted by Bayesian rule based skin color segmentation. Morphological operations are performed in the segmented hand region by observing key geometric features. A probabilistic modeling of the geometric features of finger movement has made the finger type recognition process significantly robust. Proposed method can be employed in a variety of applications like sign language recognition and human robot interactions.",60,"Fingertip detection for hand pose recognition
MK Bhuyan, DR Neog, MK Kar - International Journal on Computer Science and …, 2012
Cited by 60 Related articles All 3 versions",{},501,,,,,,,
Robust 3D Gaze Estimation,Debanga Raj Neog,2012,,,,,,0,,{},,,,,,,,University of British Columbia
Hand pose identification from monocular image for sign language recognition,"Manas Kamal Bhuyan, Mithun Kumar Kar, Debanga Raj Neog",2011/11/16,,,,IEEE,"In this paper, a novel approach for hand pose recognition is proposed by analyzing the textures and key geometrical features of the hand. A skeletal hand model is constructed to analyze the abduction/adduction movements of the fingers and subsequently, texture analysis is performed to consider some inflexive finger movements. Probabilistic distributions of the geometric features are considered for modelling intra-class abduction/adduction variations. Gestures differing in inflexive positions of fingers are classified based on Homogeneous Texture Descriptors (HTD), where the texture region is characterized using the mean energy and energy deviation from a set of frequency channels. Similarity measures are computed between input gestures and pre-modelled gesture patterns from a database by considering intra class abduction/adduction angle variations and inter class inflexive variations. Experimental results …",37,"Hand pose identification from monocular image for sign language recognition
MK Bhuyan, MK Kar, DR Neog - 2011 IEEE International Conference on Signal and …, 2011
Cited by 37 Related articles All 2 versions","{'2011': 1, '2012': 1, '2013': 2, '2014': 2, '2015': 6, '2016': 3, '2017': 8, '2018': 2, '2019': 2, '2020': 5, '2021': 1, '2022': 2, '2023': 2}",378-383,2011 IEEE International Conference on Signal and Image Processing Applications (ICSIPA),,,,,,
Finger tips detection for two handed gesture recognition,"MK Bhuyan, Mithun Kumar Kar, Debanga Raj Neog",2011/9/30,,8285,,SPIE,"In this paper, a novel algorithm is proposed for fingertips detection in view of two-handed static hand pose recognition. In our method, finger tips of both hands are detected after detecting hand regions by skin color-based segmentation. At first, the face is removed in the image by using Haar classifier and subsequently, the regions corresponding to the gesturing hands are isolated by a region labeling technique. Next, the key geometric features characterizing gesturing hands are extracted for two hands. Finally, for all possible/allowable finger movements, a probabilistic model is developed for pose recognition. Proposed method can be employed in a variety of applications like sign language recognition and human-robot-interactions etc.",1,"Finger tips detection for two handed gesture recognition
MK Bhuyan, MK Kar, DR Neog - International Conference on Graphic and Image …, 2011
Cited by 1 Related articles All 5 versions",{'2015': 1},290-299,International Conference on Graphic and Image Processing (ICGIP 2011),,,,,,
An interval type 2 fuzzy approach to multilevel image segmentation,"Debanga Raj Neog, Muhammad Amjad Raza, Frank Chung-Hoon Rhee",2011/6/27,,,,IEEE,"In this paper, an interval type 2 (IT2) fuzzy entropy based approach is used to compute optimum thresholds for multistage gray scale image segmentation. By finding the maximum IT2 fuzzy entropy of the gray scale image, the optimum thresholds are computed. A termination criterion for multistage segmentation is also proposed based on the range of computed entropy values of the images. Several experimental results are shown to demonstrate the performance of our proposed algorithm which outperforms type 1 (T1) fuzzy based methods.",7,"An interval type 2 fuzzy approach to multilevel image segmentation
DR Neog, MA Raza, FCH Rhee - 2011 IEEE International Conference on Fuzzy Systems …, 2011
Cited by 7 Related articles All 3 versions",{},1164-1170,2011 IEEE International Conference on Fuzzy Systems (FUZZ-IEEE 2011),,,,,,
Hand pose recognition using geometric features,"MK Bhuyan, Debanga Raj Neog, Mithun Kumar Kar",2011/1/28,,,,IEEE,"In this paper, a novel approach for hand pose recognition by using key geometrical features of hand is proposed. A skeletal hand model is constructed to analyze the abduction and adduction movements of the fingers and these variations are modeled by multidimensional probabilistic distributions. For recognizing hand poses, proximity measures are computed between input gestures and pre-modeled gesture patterns. The proposed algorithm is more robust to the improper hand segmentation and side movements of fingers. Experimental results show that the proposed method is very much suitable for the applications related to Human Computer Interactions (HCI).",45,"Hand pose recognition using geometric features
MK Bhuyan, DR Neog, MK Kar - 2011 National Conference on Communications (NCC), 2011
Cited by 45 Related articles All 6 versions","{'2011': 2, '2012': 8, '2013': 5, '2014': 6, '2015': 6, '2016': 7, '2017': 4, '2018': 3, '2019': 1, '2020': 1}",1-5,"Communications (NCC), 2011 National Conference on",,,,,,
Shape from an Endoscope Image Using Extended Fast Marching Method,"DR Neog, Y Iwahori, MK Bhuyan, RJ Woodham, K Kasugai",2011,IICAI'11,,,,,12,"Shape from an Endoscope Image using Extended Fast Marching Method.
DR Neog, Y Iwahori, MK Bhuyan, RJ Woodham… - IICAI, 2011
Cited by 12 Related articles",{},1006-1015,,,,,,,
ACIT-CSI 2015 International Program Committee,"Roger Lee, Kensei Tsuchida, Takaaki Goto, Atsuo Hazeyama, Kunihito Hoki, Hiroaki Hirata, Atsushi Nunome, Hiroki Nomiya, Mitsuru Nakata, Teruhisa Hochin, Kazunari Morimoto, Emi Koyama",,,,,,"ACIT-CSI 2015 International Program Committee Page 1 ACIT-CSI 2015 International Program Committee ACIT 2015 Organizers General Chair Roger Lee, Central Michigan University, USA Conference Chair Kensei Tsuchida, Toyo University, Japan. Program Chair Takaaki Goto, Ryutsu Keizai University, Japan ACIT 2015 Track 1, Software Engineering Track Chair Atsuo Hazeyama, Tokyo Gakugei University, Japan ACIT 2015 Track 2, Game Informatics Track Chair Kunihito Hoki, The University of Electro-Communications, Japan ACIT 2015 Special Session 1, System Optimization and Support for Databases Special Session Chairs Hiroaki Hirata, Kyoto Institute of Technology, Japan Atsushi Nunome, Kyoto Institute of Technology, Japan ACIT 2015 Special Session 2, Advanced Information Management for Affective and Human-Centered Information Systems Special Session Chairs Hiroki Nomiya, Kyoto Institute of …",0,"ACIT-CSI 2015 International Program Committee
R Lee, K Tsuchida, T Goto, A Hazeyama, K Hoki…",{},,,,,,,,
内視鏡画像からの鏡面反射成分除去と反射率一様化による Lambert 画像の生成,"Yuki Shimasaki, Yuji Iwahori, Debanga Raj Neog, Kunio Kasugai",,,,,,"医療の現場において内視鏡カメラを用いた診察は盛んに行われている. その中でポリープを認識することは重要である. しかし, 内視鏡を用いた診察は経験豊富な医師においても判断が困難となる状況も多く, 診察時間が長引くことで, 医師, 患者双方の負担が増えるといった問題がある. そこで, 医師の経験に左右されずにポリープを認識することを目的として撮影された内視鏡画像からのポリープの形状を復元することを目的として, 撮影された内視鏡画像からの形状復元が研究されている. 三次元の情報が得られることで, 診断時間の短縮のほか, 患者へのわかりやすい説明ができるなどのメリットも期待されている. 従来の形状復元手法として, 内視鏡環境である点光源, 透視投影下での反射率一様な完全拡散反射 (Lambert 反射) を仮定して, 画像 1 枚から形状を復元する手法が提案されている [1]. しかし, 実際に撮影された内視鏡画像のほとんどには鏡面反射成分が含まれており, Lambert 反射の仮定では条件に当てはまらない. また, 様々なテクスチャが存在しているために複数の色を持 …",0,"内視鏡画像からの鏡面反射成分除去と反射率一様化による Lambert 画像の生成
Y Shimasaki, Y Iwahori, DR Neog, K Kasugai
Related articles",{},,,,,,,,
